{
  "$schema": "https://json-schema.org/draft/2020-12/schema",
  "title": "MiSTer Companion Hub Item",
  "type": "object",
  "required": [
    "schema_version",
    "id",
    "category",
    "type",
    "handler",
    "name",
    "author",
    "date_added",
    "description",
    "visibility",
    "sort_order"
  ],
  "properties": {
    "schema_version": {
      "type": "integer",
      "const": 1
    },
    "id": {
      "type": "string",
      "pattern": "^[a-z0-9_]+$"
    },
    "category": {
      "type": "string",
      "enum": [
        "scripts",
        "cores",
        "extras",
        "roms",
        "wallpaper_packs"
      ]
    },
    "type": {
      "type": "string",
      "enum": [
        "script",
        "core",
        "extra",
        "rom",
        "wallpaper_pack"
      ]
    },
    "handler": {
      "type": "string",
      "minLength": 1
    },
    "name": {
      "type": "string",
      "minLength": 1
    },
    "author": {
      "type": "string",
      "minLength": 1
    },
    "version": {
      "type": "string",
      "minLength": 1
    },
    "release_date": {
      "type": "string",
      "pattern": "^\\d{4}-\\d{2}-\\d{2}$"
    },
    "date_added": {
      "type": "string",
      "format": "date-time"
    },
    "description": {
      "type": "string",
      "minLength": 1
    },
    "tags": {
      "type": "array",
      "items": {
        "type": "string",
        "minLength": 1
      },
      "uniqueItems": true
    },
    "visibility": {
      "type": "string",
      "enum": [
        "public",
        "hidden",
        "dev_only",
        "deprecated"
      ]
    },
    "sort_order": {
      "type": "integer"
    },
    "official_url": {
      "type": "string",
      "minLength": 1
    },
    "project_url": {
      "type": "string",
      "minLength": 1
    },
    "system": {
      "type": "string",
      "minLength": 1
    },
    "genres": {
      "type": "array",
      "items": {
        "type": "string",
        "minLength": 1
      },
      "minItems": 1,
      "uniqueItems": true
    },
    "default_install_path": {
      "type": "string",
      "pattern": "^/games/.+"
    },
    "allow_custom_install_path": {
      "type": "boolean"
    },
    "download": {
      "type": "object",
      "required": [
        "url",
        "type"
      ],
      "properties": {
        "url": {
          "type": "string",
          "minLength": 1
        },
        "type": {
          "type": "string",
          "enum": [
            "file",
            "archive"
          ]
        },
        "install_extensions": {
          "type": "array",
          "items": {
            "type": "string",
            "pattern": "^\\."
          },
          "minItems": 1,
          "uniqueItems": true
        }
      },
      "additionalProperties": false
    },
    "redistribution_status": {
      "type": "string",
      "enum": [
        "license",
        "permission",
        "public_domain",
        "official_source_only"
      ]
    },
    "license_name": {
      "type": "string",
      "minLength": 1
    },
    "license_url": {
      "type": "string",
      "minLength": 1
    },
    "source_url": {
      "type": "string",
      "minLength": 1
    },
    "permission_note": {
      "type": "string",
      "minLength": 1
    },
    "permission_date": {
      "type": "string",
      "pattern": "^\\d{4}-\\d{2}-\\d{2}$"
    },
    "redistribution_notes": {
      "type": "string",
      "minLength": 1
    }
  },
  "additionalProperties": false,
  "allOf": [
    {
      "if": {
        "properties": {
          "type": {
            "const": "rom"
          }
        }
      },
      "then": {
        "required": [
          "version",
          "official_url",
          "system",
          "genres",
          "default_install_path",
          "allow_custom_install_path",
          "download"
        ]
      }
    }
  ]
}
