{
  "schema_version": 1,
  "id": "dav_browser",
  "category": "scripts",
  "type": "script",
  "handler": "dav_browser",
  "name": "dav_browser",
  "author": "Anime0t4ku",
  "date_added": "2026-06-23T00:00:00Z",
  "description": "DAV Browser lets your MiSTer browse a WebDAV server, such as a NAS or remote file server, download ROMs or files, and optionally launch them after downloading.",
  "visibility": "public",
  "sort_order": 70,
  "project_url": "https://github.com/Anime0t4ku/0t4ku-mister-scripts"
}
