{
  "schema_version": 1,
  "id": "3s_arm",
  "category": "extras",
  "type": "extra",
  "handler": "3s_arm",
  "name": "3S-ARM",
  "author": "kimchiman52",
  "date_added": "2026-06-23T00:00:00Z",
  "description": "3S-ARM brings Street Fighter III: 3rd Strike support to MiSTer through the 3S-ARM core and its required game resources.",
  "visibility": "public",
  "sort_order": 10,
  "project_url": "https://github.com/kimchiman52/3s-mister-arm"
}
