{
  "schema_version": 1,
  "id": "static_wallpaper",
  "category": "scripts",
  "type": "script",
  "handler": "static_wallpaper",
  "name": "static_wallpaper",
  "author": "Anime0t4ku",
  "date_added": "2026-06-23T00:00:00Z",
  "description": "static_wallpaper lets your MiSTer use a fixed menu wallpaper instead of the default changing wallpaper behavior.",
  "visibility": "public",
  "sort_order": 90,
  "project_url": "https://github.com/Anime0t4ku/0t4ku-mister-scripts"
}
