{
  "schema_version": 1,
  "id": "pcn_premium_wallpapers",
  "category": "wallpaper_packs",
  "type": "wallpaper_pack",
  "handler": "wallpaper_pack",
  "name": "PCN Premium Member Wallpapers",
  "author": "Anime0t4ku",
  "date_added": "2026-06-23T00:00:00Z",
  "description": "A wallpaper pack created for PCN Premium members on YouTube and Patreon. These wallpapers are made as exclusive extras for PCN supporters.",
  "visibility": "public",
  "sort_order": 30,
  "project_url": "https://github.com/Anime0t4ku/MiSTerWallpapers"
}
