{
  "schema_version": 1,
  "id": "physical_disc_cores",
  "category": "cores",
  "type": "core",
  "handler": "physical_disc_cores",
  "name": "Physical Disc Cores",
  "author": "Anime0t4ku",
  "date_added": "2026-07-21T00:00:00Z",
  "description": "Adds physical CD support to selected MiSTer cores using compatible external USB CD/DVD drives. Compatibility and performance may vary depending on the drive.",
  "visibility": "public",
  "sort_order": 22
}