{
  "schema_version": 1,
  "id": "ftp_save_sync",
  "category": "scripts",
  "type": "script",
  "handler": "ftp_save_sync",
  "name": "ftp_save_sync",
  "author": "Anime0t4ku",
  "date_added": "2026-06-23T00:00:00Z",
  "description": "ftp_save_sync automatically syncs your MiSTer saves to a remote FTP or SFTP server. It can also sync savestates and keep saves shared between multiple MiSTers.",
  "visibility": "public",
  "sort_order": 80,
  "project_url": "https://github.com/Anime0t4ku/0t4ku-mister-scripts"
}
