{
  "schema_version": 1,
  "id": "anime0t4ku_wallpapers",
  "category": "wallpaper_packs",
  "type": "wallpaper_pack",
  "handler": "wallpaper_pack",
  "name": "Anime0t4ku Wallpapers",
  "author": "Anime0t4ku",
  "date_added": "2026-06-23T00:00:00Z",
  "description": "A personal wallpaper pack by Anime0t4ku, made without fixed constraints. Themes can vary across anime, movies, games, systems, comics, and more.",
  "visibility": "public",
  "sort_order": 40,
  "project_url": "https://github.com/Anime0t4ku/MiSTerWallpapers"
}
